B00AWU8WO4,simple,demo305,The Accidental Demon Slayer,1,0,visible,,,,taxable,,1,,,0,0,,,,,0,,,,,,,,,,,,,TRUE,-16,"My name is Lizzie Brown, and demon slayer wasn't my first career choice. It didn't even crack the list. I had a good thing going as a preschool teacher until my long-lost Granny blew into my life riding a Harley and raving about a demon on my toilet.\n\nWhy did she have to be right?\n\nHe was from the seventh layer of hell, and I killed his ass faster than you can say flush. Now Grandma insists I'm a demon slayer, destined to ride with her geriatric gang of biker witches.\n\nDo I even own a leather jacket?\n\nCrazier still, this new job comes with my own personal protector: Dimitri Kallinikos, a devastatingly hot shape-shifting griffin with beautiful eyes and a not-so-secret plan to seduce me.\n\nI could get on board with that.\n\nBut I can't get too involved because Dimitri needs me to take care of some hellish personal business for him, and I'm not about to let a guy I barely know take me anywhere near the underworld. At least not on the first date. But there's a bigger danger brewing than either of us can imagine-and if I can't stop the rise of Hell on Earth, no one can.",305,0.99,Angie Fox,Mystery/Thriller,https://shopper915963729.wpcomstaging.com/wp-content/uploads/2022/05/305.jpg
B08L626591,simple,prince405,The Prince And The Troll,1,0,visible,,,,taxable,,1,,,0,0,,,,,0,,,,,,,,,,,,,TRUE,-16,"A charming everyman and a mysterious something-under-the-bridge cross paths in a short fairy tale by the number one New York Times bestselling author of Eleanor & Park and the Simon Snow series.\n\nIt's fate when a man accidentally drops his phone off the bridge. It's fortune when it's retrieved by a friendly shape sloshing in the muck underneath. From that day forward, as they share a coffee every morning, an unlikely friendship blooms. Considering the reality for the man above, where life seems perfect, and that of the sharp-witted creature below, how forever after can a happy ending be?'",405,1.99,Rainbow Rowell,Fantasy,https://shopper915963729.wpcomstaging.com/wp-content/uploads/2022/05/405.jpg
B089P2ZFYC,simple,giza505,The Secret Of Giza,1,0,visible,,,,taxable,,1,,,0,0,,,,,0,,,,,,,,,,,,,TRUE,-16,"What if humanity didn't start on Earth..?\n\nAn incredible discovery deep inside the Great Pyramid, a mysterious signal sent from the Bermuda Triangle, and a ruthless experiment taking place in Area 51: How are they all connected?\n\nWhen Malia Kwan exhibits unusual abilities, government agents show up at her home to apprehend her and her twin brother, Jaden-and all hell breaks loose. After their parents are killed, Jaden and Malia flee into the night, becoming fugitives. Before long, they discover their true identities are tied to the lost city of Atlantis-and to the origins of humanity itself. And now a threat emerges that could wipe out the entire human race-unless Jaden and Malia can stop it!\n\nIf you like fast-paced thrillers with mysteries of historical significance, you'll love The Secret of Giza!""",505,0.99,Ken Warner,Science Fiction,https://shopper915963729.wpcomstaging.com/wp-content/uploads/2022/05/505.jpg
B09NKRK457,simple,trayvon106,Trayvon: Ten Years Later,1,0,visible,,,,taxable,,1,,,0,0,,,,,0,,,,,,,,,,,,,TRUE,-15,"Ten years after the tragic killing of her seventeen-year-old son, Trayvon Martin, Sybrina Fulton has become both the unyielding matriarch of a national conversation and one of the most incredible activators of change in our time. While grappling with the ongoing process of making sense of her grief, anger, and cherished memories, she fights every day for justice.\n\nIn this moving essay, Sybrina imparts to this generation and the next the lessons and wisdom she's gained in the past ten years-about life, love, and loss; about bad faith; about what changes have and have not occurred; and about the power of her own voice in the gathering storm of a profoundly divided country. Above all, Sybrina knows what it takes to keep moving forward.",106,1.99,Sybrina Fulton,Biography/Memoir,https://shopper915963729.wpcomstaging.com/wp-content/uploads/2022/05/106.jpg
B09SY3M8GL,simple,truck206,Truck Driver,1,0,visible,,,,taxable,,1,,,0,0,,,,,0,,,,,,,,,,,,,TRUE,-15,"He walked into the truck stop diner one rainy night and my life was never the same. The mysterious big rig driver made me feel flustered in ways I barely understood, with his hands. His words. His observant eyes. Now he's telling me that I'm unsafe. That I'm in serious danger, unless I trust him. In all ways. Physically. Emotionally. In the back of his rig, I become his, without exception. But our happy ending could be cut short by the men who want to hurt me. They underestimated what my truck driver would do to keep me safe, though...and come home to me forever.",206,0.99,Jessa Kane,Romance,https://shopper915963729.wpcomstaging.com/wp-content/uploads/2022/05/206.jpg
B09HQZDJV5,simple,purpose306,Dark Purpose,1,0,visible,,,,taxable,,1,,,0,0,,,,,0,,,,,,,,,,,,,TRUE,-15,"Everyone has a purpose. Some are just darker than others.\n\nAlways calm, cool, and collected, Savannah PD Detective Charli Cross compensates for her petite five-foot frame with an impenetrable exterior and pragmatic competence. It's an approach that catapulted her to the rank of detective at twenty-three and contributes to her and her partner's unequaled murder clearance rate. But when a bird-watching couple discover the remains of a teenage girl stuffed in a storage container, Charli's composure starts to crack.\n\nNot only is the murder horrifying, it dredges up memories of Charli's best friend. Madeline was only sixteen when her body was found a mere half-mile from the grisly discovery. Add the sadistic sexual component to this recent crime, as well as the location of the body, and Charli fears they are facing the hallmarks of the worst kind of serial killer-one who's organized and thorough. One intent on fulfilling his dark purpose.\n\nCharli wants to stay unemotional. But when more victims are discovered, she is determined to stop the killer before he strikes again.\n\nThis time, it's not just her job. It's personal.",306,1.49,Mary Stone,Mystery/Thriller,https://shopper915963729.wpcomstaging.com/wp-content/uploads/2022/05/306.jpg
B07TN65C7B,simple,shadows406,Shadows And Shade,1,0,visible,,,,taxable,,1,,,0,0,,,,,0,,,,,,,,,,,,,TRUE,-15,"When the Elorsin brothers venture onto our estate in search of a mysterious bird, just in time to catch me on the wrong end of my master's temper, they somehow also acquire me.\n\nAcquire, kidnap, rescue - is there a difference?\n\nSure, four of the scariest immortals in existence may actually have saved my life, but blending in as a servant in the Elite training castle that I now call home is almost impossible with these four powerful, dark, and broken men focusing their attention on me - and it's not always good attention.\n\nNot helped when the trickster among them suggests playing a potion-prank on the psychopath currently in line for the throne. He shouldn't be in line for the throne. Pax, aka Scary Kidnapper Number One, should be. But whatever or whoever tore this distant world apart, they did so with enough ferocity to leave Pax in a permanent foul mood - and the others aren't much better.\n\nEither my kidnappers, I mean rescuers, leave me alone - which will mean leaving me to be discovered by a king who has a nasty habit of sucking the life from his servants.\n\nOr they claim me for themselves and protect me from an unstoppable prophecy, a secret slowly decaying the Veil - and each other.\n\nIf you're ever in my shoes, I recommend revenge involving food and the boots of a certain growling alpha male, followed by kicking the nearest dethroned immortal prince in the balls.",406,2.99,Amanda Cashure,Fantasy,https://shopper915963729.wpcomstaging.com/wp-content/uploads/2022/05/406.jpg
B098QNLW6D,simple,clap506,Clap Back,1,0,visible,,,,taxable,,1,,,0,0,,,,,0,,,,,,,,,,,,,TRUE,-15,"A past struggle for racial equity could achieve a profound future victory in this audacious short story about technology, hoodoo, and hope by a Nebula Award-winning author.\n\nBurri is a fashion designer and icon with a biochemistry background. Her latest pieces are African inspired and crafted to touch the heart. They enable wearers to absorb nanorobotic memories and recount the stories of Black lives and forgiveness. Wenda doesn't buy it. A protest performance artist, Wenda knows exploitation when she sees it. What she's going to do with Burri's breakthrough technology could, in the right hands, change race relations forever.",506,1.99,Nalo Hopkinson,Science Fiction,https://shopper915963729.wpcomstaging.com/wp-content/uploads/2022/05/506.jpg
B07YXSLVX7,simple,about107,It's Not About You,1,0,visible,,,,taxable,,1,,,0,0,,,,,0,,,,,,,,,,,,,TRUE,-14,"Life is not about you. It's about what you do for others. That's the realization that has driven Tom Rath-the mega-bestselling expert in self-development research-to evolve his focus from one's inward search for strength to the larger outward search for purposeful contribution to others. It's Not About You is a short introduction to the next chapter in the life and career of perhaps our greatest living self-help writer.\n\nDiagnosed with a rare genetic condition at age sixteen, Tom's awareness of his own mortality drove him to pursue a meaningful life in the nurturing care of his family, including his eventual mentor and collaborator, Tom's grandfather Don Clifton. In this empowering hybrid of a self-help memoir, Tom remembers and celebrates his greatest teacher as he emphatically encourages each and every one of us to answer life's great question: What can I put into the world?'",107,1.99,Tom Rath,Biography/Memoir,https://shopper915963729.wpcomstaging.com/wp-content/uploads/2022/05/107.jpg
B09RB5W9JW,simple,instructor207,Private Instructor,1,0,visible,,,,taxable,,1,,,0,0,,,,,0,,,,,,,,,,,,,TRUE,-14,"About 40 percent of the general population reports some fear of flying.\nFor Nicole Jensen, this is more than just a statistic. It's a reality she lives with daily. So when Nicole is thrust into planning a convention out of state, she soon realizes that she might have to face that fear head-on.\nEnter Nash Taylor, former playboy pilot, occasional as$hole, and way too good-looking for Nicole to take seriously. But the more time they spend together, the more she realizes that Nash is way more than what she thought, and falling for him becomes harder and harder.\nWithout realizing it, Nicole and Nash need each other in ways neither of them expected. But will Nicole's past hinder their connection or allow it to take off?""",207,2.99,S.A. Clayton,Romance,https://shopper915963729.wpcomstaging.com/wp-content/uploads/2022/05/207.jpg
B07PP9N4D8,simple,lie307,Don't Lie To Me,1,0,visible,,,,taxable,,1,,,0,0,,,,,0,,,,,,,,,,,,,TRUE,-14,"When twelve-year-old Sophie Williams went on a Girl Scout summer camp, she never returned home.\nThree months later, her body is found inside her sleeping bag in the most frequented area of Cocoa Beach, and the town is outraged.\n\nThe girl isn't just any child. She's the town's most beloved surf idol, and it was believed that she could be the next Kelly Slater.\n\nAs another child, the son of a well-known senator is kidnapped, and the parents receive a disturbing video, FBI profiler Eva Rae Thomas - who has just returned to her hometown, divorced and out of a job - plunges into the investigation, breaking her promise to her children not to do police work again.\n\nWith her old flame Matt Miller in charge, local law enforcement are the ones who ask for her help in a case so unsettling that only she can solve it. But the deeper they dig, the deadlier it becomes for Matt and Eva Rae. Soon, everyone she holds dear is in grave danger as this case hits a little too close to home.",307,0.99,Willow Rose,Mystery/Thriller,https://shopper915963729.wpcomstaging.com/wp-content/uploads/2022/05/307.jpg
B09RW13C5Y,simple,secret407,Secret Of The Broken King,1,0,visible,,,,taxable,,1,,,0,0,,,,,0,,,,,,,,,,,,,TRUE,-14,"He married me, exiled me, and now he's the only thing stopping me from saving my sister.\n\nMy sister is turning to stone. She's been asleep for eight years - the same amount of time I've been the secret, exiled wife of the King of the Ocean.\nPoseidon is fierce, unforgiving, and terrifyingly powerful.\nI'm just a broken sea nymph whose magic never surfaced.\nBut the only way to save my sister lies in his underwater palace, and I've got nothing else to lose.\n\nI expected escaping exile and getting to the palace to be tough. What I didn't anticipate was battling a torrent of unexpected desire for Poseidon when he catches me.\nThe devastatingly beautiful ocean god has secrets. Wild waves crash through his eyes when he looks at me, and I soon realize he might be just as broken as I am.\n\nBut when a god has secrets, the consequences are deadly.",407,2.99,Eliza Raine,Fantasy,https://shopper915963729.wpcomstaging.com/wp-content/uploads/2022/05/407.jpg
B08F7Q79DM,simple,earth507,Primordial Earth,1,0,visible,,,,taxable,,1,,,0,0,,,,,0,,,,,,,,,,,,,TRUE,-14,"This is their world, and we are the prey.\nAfter an unexplained event shifted entire cities millions of years into the past, life has become a daily struggle for survival. Rogue, tenacious and fierce, has never known anything except a harsh life on the streets of Prime City until she finds herself on the wrong side of the law... and the wall.\n\nNothing could've prepared her for the outside...\nExiled, unarmed, and alone, she faces a perilous journey into a savage prehistoric world. With nothing but her wits, she sets out into the unknown. Can she find a way to survive or will the primordial land claim another victim?'",507,0.99,Baileigh Higgins,Science Fiction,https://shopper915963729.wpcomstaging.com/wp-content/uploads/2022/05/507.jpg
B007AIT48O,simple,sixminutes108,Six Minutes To Freedom,1,0,visible,,,,taxable,,1,,,0,0,,,,,0,,,,,,,,,,,,,TRUE,-13,"Dear President Bush,\nMy name is Kimberly Anne Muse. I am writing this letter not for me but for my father, Kurt Frederick Muse. As you should know by now, he is a political prisoner in Panama. . ..\n\nBorn in the United States and raised in Panama, Kurt Muse grew up with a deep love for his adopted country. But the crushing regime of General Manuel Noriega in the late 1980s threatened his, and a nation's, freedom. A nightmare of murder and unexplained disappearances compelled Kurt and a few trusted friends to begin a clandestine radio campaign, urging the people of Panama to rise up for their basic human rights.\n\nSix Minutes to Freedom is the remarkable tale of Kurt Muse's arrest and harrowing months of imprisonment; his eyewitness accounts of torture; and the plight of his family as they fled for their lives. It is also the heart-pounding account of the only American civilian ever rescued by the elite Delta Force. Timelier than ever, this is a thrilling and highly personal narrative about one man's courage and dedication to his beliefs.",108,1.99,Kurt Muse,Biography/Memoir,https://shopper915963729.wpcomstaging.com/wp-content/uploads/2022/05/108.jpg
B084VVGLY4,simple,mistress208,The School Mistress,1,0,visible,,,,taxable,,1,,,0,0,,,,,0,,,,,,,,,,,,,TRUE,-13,"Colorado, 1910. Quinn Cooper can't help feeling uneasy. But securing a job as a schoolmarm in a tiny frontier town was the only way to save her family from starvation back in Boston. And her nerves aren't eased by a stray gunshot that spooks the sleigh horses, casting her into the snow- until she's rescued by a handsome stranger.\nLord Alexander Barnes knows better than to believe any pretty young woman would willingly become a mother to five children. But the lonely widower finds himself charmed by the lovely newcomer and her easy rapport with his offspring. And after his disgruntled nanny quits, his heart melts at the sight of her joyfully taking over the role.\n\nDetermined to prove herself in the schoolhouse and as a governess, Quinn fears her near-poverty will prevent any possible courtship with the affluent Englishman. And between their age difference and prejudicial violence in the town, Lord Barnes is certain this second chance at happiness just cannot be.\n\nWill their love go unspoken, or will their persistence reward them with a lasting passion?'",208,0.99,Tess Thompson,Romance,https://shopper915963729.wpcomstaging.com/wp-content/uploads/2022/05/208.jpg
B09BTTXJ4F,simple,remember308,Remember Me?,1,0,visible,,,,taxable,,1,,,0,0,,,,,0,,,,,,,,,,,,,TRUE,-13,"A perfect life-\n\nPaul Henderson leads a normal life. A deputy headteacher at a good school, a loving relationship with girlfriend Jenna, and a baby on the way. Everything seems perfect.\n\nA shocking message-\n\nUntil Paul receives a message from his ex-fiance Nicole. Beautiful, ambitious and fierce, Nicole is everything Jenna is not. And now it seems Nicole is back, and she has a score to settle with Paul-\n\nA deadly secret.\n\nBut Paul can't understand how Nicole is back. Because he's pretty sure he killed her with his own bare hands-.\n\nWhich means, someone else knows the truth about what happened that night. And they'll stop at nothing to make Paul pay-'",308,0.99,Amanda Rigby,Mystery/Thriller,https://shopper915963729.wpcomstaging.com/wp-content/uploads/2022/05/308.jpg
B07NYDVQVT,simple,witch408,Witch's Sorrow,1,0,visible,,,,taxable,,1,,,0,0,,,,,0,,,,,,,,,,,,,TRUE,-13,"An amateur witch. A dark past. A fierce deceit.\n\nPaladin Agent Alice Skye didn't think much of the contract forced upon her by Rexley Wild, Alpha of one of the largest packs in Europe. \n\nHe hired her for one job. \n\nFind the missing wolf.\n\nUnfortunately for Alice, she might already be too late.\n\nShe's in way over her head, an inexperienced witch who has to use all her instincts to help the secretive and detached Alpha find his missing pack mate. But it isn't long before she realises something's not quite right. It's not simply a missing person, it was something a lot closer to home, something that reignites nightmares that make her question her own, horrific past.\n\nAlice is in a race against time that forces her to face against vampires, daemons and anything that gets in the way, for she only has one thing to do, find the wolf before he turns up like the others. \n\nDead.",408,2.99,Taylor Aston White,Fantasy,https://shopper915963729.wpcomstaging.com/wp-content/uploads/2022/05/408.jpg
B08ZFZ36HM,simple,visitor508,Visitor,1,0,visible,,,,taxable,,1,,,0,0,,,,,0,,,,,,,,,,,,,TRUE,-13,"The ultimate secrets of the universe awaits those who dare to risk everything.\nYears have passed since Earth encountered its first known interstellar object: Oumuamua. Now an even larger one has been discovered, following the exact same trajectory as its predecessor. Scientists around the world theorize that this can no longer be passed off as mere coincidence-the new contact must be an artificial construct of some kind.\n\nWith an ambitious plan to build a spacecraft and attempt a manned landing, a crew is formed. Disgraced astronaut Cassie Voges hopes to get selected for one last chance at redemption. Maverick billionaire Toby Merckx wants to beat his rivals to the extraordinary secrets he believes the object may unlock. And its controversial discoverer, Charles Hudson, seeks to escape his past and be remembered for something better.\n\nWhat they find will change humanity forever.\n\nCombining hard-edged, scientific realism with thrilling action and the mysteries of the unknown, this epic novel is suitable for fans of 2001: A Space Odyssey and Rendezvous with Rama.",508,0.99,John Triptych,Science Fiction,https://shopper915963729.wpcomstaging.com/wp-content/uploads/2022/05/508.jpg
B09YL4KZKJ,simple,zendancing109,The Zen Of Dancing In The Rain,1,0,visible,,,,taxable,,1,,,0,0,,,,,0,,,,,,,,,,,,,TRUE,-12,"Society has become a place where combat veterans would rather commit suicide than live. Many who ""have it all"" are discovering that they still feel miserable but can't figure out why. They feel powerless under the boredom of what society deems necessary.\n\nAurita Maldonado is a Puerto Rican woman warrior and Afro Latin dance instructor who chose a different path before and after her two combat tours in Afghanistan and Iraq.\n\nShe received a Purple Heart for wounds received in Afghanistan before leaving the Army to align her thoughts, words, and actions. She adopted a new mission: cultivate peace, happiness, and learn to become her own best friend. All while learning to live as one with Mother Earth.\n\nAurita rejected lucrative government jobs, sold her possessions, and moved to Haines, Alaska, in 2010 to begin her journey with PTSD and self-acceptance. An extreme athlete, she used movement to help her navigate the storms with a grin until she was suddenly paralyzed from the waist down ina fight against a deadly rat lungworm infection.\n\nThe perspective shifts she adopted to continue to enjoy life while learning to use her body again will make you reassess your choices to settle for the status quo.\n\nThis is an inspirational memoir of a remarkable woman's journey to stumble in style as she navigates seemingly insurmountable tragedies early in life. It is a story of triumph and discipline. Joy and sorrow. A portrait of a Lady Hurricane dancing, both literally and figuratively as one with the storms of life.",109,0.99,Aurita Maldonado,Biography/Memoir,https://shopper915963729.wpcomstaging.com/wp-content/uploads/2022/05/109.jpg
B08BZDFFPK,simple,billionaire209,The Billionaire's Fake Wife,1,0,visible,,,,taxable,,1,,,0,0,,,,,0,,,,,,,,,,,,,TRUE,-12,"I never should have agreed to become his fake wife...\n\nSinclair Amadeus Sterling aka\nMr. Superior Jackass with a God complex.\nWho also happens to be my blackmailer... gulp.\nTall, dark, gazzilionaire growly pants.\nThe first time I met him, I kneed him in his very well endowed balls, don't ask!\nHe had that tightly leashed, controlling air and a smoldering glare that made me damp in seconds.\nThe only thing that sucks worse than his attitude is his (lack of) sense of humor! Honest.\nSadly, he's also the one who could save my business from going bust. Hell!\nSo when he offers me the chance to work with him, I can hardly refuse, right?\nOnly catch? I need to be his pretend wife for hold-your-breath, thirty days.\nI should have turned and run right then, but...\nHe has the connections to help my sister's failing health, not to mention the money to wipe away my debt.\nAnd yeah that... sneaky video recording of him getting me off. OMG!\nBesides, it's only thirty days, right?\nIt's not like I'm in danger of falling in love with London's most notorious bachelor.\nThen he tells me the real reason for the charade.\nAnd everything changes...",209,2.99,L. Steele,Romance,https://shopper915963729.wpcomstaging.com/wp-content/uploads/2022/05/209.jpg
B07RNDMDSV,simple,justice309,Saint Justice,1,0,visible,,,,taxable,,1,,,0,0,,,,,0,,,,,,,,,,,,,TRUE,-12,"They stole his truck. Big mistake.\n\nCIA black-ops legend Christopher Wren pulls over on a Utah highway after three weeks on the road. An arbitrary decision he's about to regret.\n\nA biker gang attacks Wren, leaves him for dead and steals his truck.\n\nNow he's going to get it back.\n\nFrom a secret warehouse in the desert. Ringed with fences. Filled with human cages.\n\nAs the body count mounts and a shocking national conspiracy unravels, one thing is for certain.\n\nJustice will be done.",309,0.99,Mike Grist,Mystery/Thriller,https://shopper915963729.wpcomstaging.com/wp-content/uploads/2022/05/309.jpg
B086XHS3ZQ,simple,luna409,Luna Rising,1,0,visible,,,,taxable,,1,,,0,0,,,,,0,,,,,,,,,,,,,TRUE,-12,"Xavier Blackwood is the man every girl at my college dreams about at night, myself included, but I'd never let anyone know that.\n\nStanding at 6'4"" with steel grey eyes, he might look like a walking dream, but he acts like a first-class jerk.\n\nWho would have thought that one night, while dragging myself home after doing double shifts at the diner, I'd be jumped by three men...only to have Xavier come to my rescue.\n\nOh yes, Xavier bloody Blackwood saved my life...but the thing I saw, the CREATURE that ripped those men to shreds, wasn't the Xavier everyone thinks they know.\n\nHe wasn't human...\n\nHe was a wolf, a demon, a creature from myth, but before I had time to process, he knocked me out too.\n\nHumans that learn about the existence of werewolves have to die.\n\n...There are NO exceptions.\n\nThe Werewolf Xavier saved me, but now I am condemned to death.\n\nTo make things worse, both Xavier and Axel claim I am their mate.\n\n...This can't be good.",409,2.99,Sara Snow,Fantasy,https://shopper915963729.wpcomstaging.com/wp-content/uploads/2022/05/409.jpg
B09MF62CMM,simple,utopia509,Relics Of Utopia,1,0,visible,,,,taxable,,1,,,0,0,,,,,0,,,,,,,,,,,,,TRUE,-12,"Windham Manthus is the captain of the Starship Gilead, the most powerful vessel in the sector. He's battled space pirates and territorial warlords in order to protect his people and his ship. His reputation as a laudable commander has spread across the galaxy, but rumors have begun that he's losing his edge.\n\nWhen a sect of fanatical cultists murder an entire colony in order to resurrect an ancient alien god, Windham's skill is put to the test. He and his crew must battle an armada of enemy gunships and hostile space marines in order to protect Gilead and save the galaxy from total destruction.\n\nFaced with a seemingly unwinnable battle, Windham must see how far he's willing to go to protect his ship. Will he make a deal with his enemy? Is he willing to sacrifice his own daughter?'",509,0.99,John Graves,Science Fiction,https://shopper915963729.wpcomstaging.com/wp-content/uploads/2022/05/509.jpg
