B08B3K4KWV,simple,punch110,Punch Me Up To The Gods,1,0,visible,,,,taxable,,1,,,0,0,,,,,0,,,,,,,,,,,,,TRUE,-11,"Punch Me Up to the Gods introduces a powerful new talent in Brian Broome, whose early years growing up in Ohio as a dark-skinned Black boy harboring crushes on other boys propel forward this gorgeous, aching, and unforgettable debut. Brian's recounting of his experiences-in all their cringe-worthy, hilarious, and heartbreaking glory-reveal a perpetual outsider awkwardly squirming to find his way in. Indiscriminate sex and escalating drug use help to soothe his hurt, young psyche, usually to uproarious and devastating effect. A no-nonsense mother and broken father play crucial roles in our misfit's origin story. But it is Brian's voice in the retelling that shows the true depth of vulnerability for young Black boys that is often quietly near to bursting at the seams.\n\nCleverly framed around Gwendolyn Brooks's poem ""We Real Cool,"" the iconic and loving ode to Black boyhood, Punch Me Up to the Gods is at once playful, poignant, and wholly original. Broome's writing brims with swagger and sensitivity, bringing an exquisite and fresh voice to ongoing cultural conversations about Blackness in America.",110,1.99,Brian Broome,Biography/Memoir,https://shopper915963729.wpcomstaging.com/wp-content/uploads/2022/05/110.jpg
B09SMTQ1J7,simple,snowstorm210,Amidst a Snowstorm Of Love,1,0,visible,,,,taxable,,1,,,0,0,,,,,0,,,,,,,,,,,,,TRUE,-11,"Abby Clayton feels devastated by her parents' decision to move from Chicago to Montana. Desperate to escape the grim reality of her new life away from everyone she loves, she often finds comfort in wandering the woods. There, she meets a mysterious Native man and from that moment on, Abby is drawn into a forbidden friendship that brings her more joy than she could ever imagine. Yet will she be able to open up her heart to a man who is shunned by the rest of society?\n\nAbsurd as she knows it to be, she may have already fallen utterly in love...\n\nKeme struggles with his interest in the white settlers and their fascinating way of life. His people and theirs have not been getting along for quite some time, and lately, tensions are high. So when he crosses paths with an intriguing white woman in the forest, he is more than caught off guard. He can't stop thinking about her and soon, he is attracted to the white man's world in a whole new way.\n\nWill Keme be able to find his way to love despite the vast divide between them?\n\nAs tensions between their people rise further, it becomes more dangerous than ever for Abby and Keme to be seen together. Will they find the courage to show what lies deep in their hearts? In the end, will they break all the barriers that are keeping them apart, or will internal battles and outside forces overpower them?'",210,0.99,Aurora Hanson,Romance,https://shopper915963729.wpcomstaging.com/wp-content/uploads/2022/05/210.jpg
B08268L6L8,simple,snowdonia310,The Snowdonia Killings,1,0,visible,,,,taxable,,1,,,0,0,,,,,0,,,,,,,,,,,,,TRUE,-11,"Starting a new life in Snowdonia was always DI Ruth Hunter's dream. Until a twisted killer turned it into her worst nightmare. \n\nDetective Inspector Ruth Hunter lives with the pain of her partner's mysterious and unsolved disappearance. About to hit fifty, the veteran police officer trades in the crime-ridden streets of London for a more peaceful life in rural North Wales. But Ruth has barely settled into her new position in North Wales Police, when the body of a brutally murdered woman is discovered-with strange symbols carved into her skin. Teaming up with an obstinate deputy, Ruth struggles to eliminate anyone from a long line of suspects. When another slain victim is discovered with the same cryptic markings, she's forced to re-think the investigation.\n\nHas Ruth got what it takes to solve the case before the murderer attacks again?""",310,2.99,Simon McCleave,Mystery/Thriller,https://shopper915963729.wpcomstaging.com/wp-content/uploads/2022/05/310.jpg
B000FC0XV4,simple,magic410,Ship Of Magic,1,0,visible,,,,taxable,,1,,,0,0,,,,,0,,,,,,,,,,,,,TRUE,-11,"Bingtown is a hub of exotic trade and home to a merchant nobility famed for its liveships-rare vessels carved from wizardwood, which ripens magically into sentient awareness. Now the fortunes of one of Bingtown's oldest families rest on the newly awakened liveship Vivacia.\n \nFor Althea Vestrit, the ship is her rightful legacy. For Althea's young nephew, wrenched from his religious studies and forced to serve aboard the ship, the Vivacia is a life sentence. But the fate of the ship-and the Vestrits-may ultimately lie in the hands of an outsider: the ruthless buccaneer captain Kennit, who plans to seize power over the Pirate Isles by capturing a liveship and bending it to his will.",410,2.99,Robin Hobb,Fantasy,https://shopper915963729.wpcomstaging.com/wp-content/uploads/2022/05/410.jpg
B09K6VFG5Z,simple,boogeyman510,Boogeyman Booty Call,1,0,visible,,,,taxable,,1,,,0,0,,,,,0,,,,,,,,,,,,,TRUE,-11,"Creatures of the night deserve a little romance too!\n\nShe was just a human, but she was everything to him.\n\nWhen an ad for Monster Match pops up on his phone, Gary the Boogeyman is intrigued, that is until the wretched programming takes over his device completely. So he fills out a profile.\n\nAll signed up and receiving DMs, Gary has no choice but to go on at least one date, but he's not looking for love or anything special. He's looking for a Bootycall and for his phone to stop acting up.\n\nBut what happens when the mystery woman is someone he knows? Someone he admires? Do humans even have big enough hearts to love creatures of the night? Demonic beings called... Boogeymen?""",510,2.99,Harpie Alexa,Science Fiction,https://shopper915963729.wpcomstaging.com/wp-content/uploads/2022/05/510.jpg
B001FA0UMM,simple,legs111,The Legs Are The Last To Go,1,0,visible,,,,taxable,,1,,,0,0,,,,,0,,,,,,,,,,,,,TRUE,-10,"It's conventional wisdom that Hollywood has no use for a woman over forty. So it's a good thing that Diahann Carroll-whose winning, sometimes controversial career breached racial barriers-is anything but conventional.\n\nHere she shares her life story with an admirable candidness of someone who has seen and done it all. With wisdom that only aging gracefully can bestow, she talks frankly about her four marriages as well as the other significant relationships in her life, including her courtship with Sidney Poitier; racial politics in Hollywood and on Broadway; and the personal cost, particularly to her family, of being a pioneer. Carroll's storied history, blunt views, and notorious wit will be sure to entertain and inform.",111,1.99,Diahann Carroll,Biography/Memoir,https://shopper915963729.wpcomstaging.com/wp-content/uploads/2022/05/111.jpg
B099J63WQW,simple,sisters211,Sisters Behaving Badly,1,0,visible,,,,taxable,,1,,,0,0,,,,,0,,,,,,,,,,,,,TRUE,-10,"Sisters Kitty and Jenny haven't spoken since a very disappointing Carvery lunch. Kitty, sixty-two, thinks Jenny is turning grey. Jenny, sixty-six, thinks Kitty needs to grow up!\n\nSo when both sisters inherit a farmhouse in rural France, it gives them the perfect chance to heal the rift between them. Except the farmhouse is a wreck, the garden is terrorized by a flock of chickens, not to mention a donkey with a serious flatulence problem!\n\nKitty is determined to enjoy herself, especially when she meets gorgeous French builder, Leo. Ooh la - la! And Jenny finds the fully stocked wine cellar helps enormously with missing horrible husband Paul - hic!\n\nAnd as the two sisters begin to repair their fragile friendship, they discover that being bad is actually very good for the soul.",211,2.99,Maddie Please,Romance,https://shopper915963729.wpcomstaging.com/wp-content/uploads/2022/05/211.jpg
B09HHFV8P2,simple,death311,Her Second Death,1,0,visible,,,,taxable,,1,,,0,0,,,,,0,,,,,,,,,,,,,TRUE,-10,"When a man is shot in the head, Bree Taggert and her new partner, veteran detective Dana Romano, respond to the call. They break the news to the victim's ex-wife and learn the estranged couple's five-year-old daughter was supposed to have been with him. What starts as a murder investigation quickly morphs into a desperate search for a missing child. The case stirs memories of Bree's own traumatizing childhood. To find the little girl, Bree will have to relive her own terrifying past.",311,1.99,Melinda Leigh,Mystery/Thriller,https://shopper915963729.wpcomstaging.com/wp-content/uploads/2022/05/311.jpg
B00DJJIR6S,simple,unfettered411,Unfettered,1,0,visible,,,,taxable,,1,,,0,0,,,,,0,,,,,,,,,,,,,TRUE,-10,"You define life or it defines you.\n\nIn Shawn Speakman's case, it was both.\n\nLacking health insurance and diagnosed with Hodgkin's lymphoma in 2011, Shawn quickly accrued a massive medical debt that he did not have the ability to pay. That's when New York Times best-selling author Terry Brooks offered to donate a short story that Shawn could sell tohelp alleviate those bills-and suggested he ask the same of his other writer friends.\n\nUnfettered is the result: an anthology built in order to relieve that debt, featuring short stories by some of the best fantasy writers in the genre.",411,2.99,Terry Brooks,Fantasy,https://shopper915963729.wpcomstaging.com/wp-content/uploads/2022/05/411.jpg
B09F8KT81B,simple,mortal511,Mortal Curse,1,0,visible,,,,taxable,,1,,,0,0,,,,,0,,,,,,,,,,,,,TRUE,-10,"A shadow. A shifter. A curse.\n\nWhen a reaper attack thrusts Dannika into the shadow shifter world and her transition results in her imprisonment, she turns to Raine, the sexy shadow who saved her.\n\nAs her attraction to Raine mounts, and dissension in the shadow shifter clan increases, she learns that being the only woman to survive the transition isn't her only secret. Her new abilities come with a price, and if she doesn't curb her killer instincts, she will end up as loathsome as the creature who attacked her.\n\nFind out what hides in the shadows by reading MORTAL CURSE, the new Paranormal Romance Series readers are comparing to Christine Feehan and Patricia Briggs.\n\nOne click MORTAL CURSE and start your paranormal adventure today!'",511,2.99,Tia Didmon,Science Fiction,https://shopper915963729.wpcomstaging.com/wp-content/uploads/2022/05/511.jpg
B09R1VWL36,simple,survived112,I Survived To Tell,1,0,visible,,,,taxable,,1,,,0,0,,,,,0,,,,,,,,,,,,,TRUE,-9,"In no less than seven concentration and exterminationcamps, the Polish-Jew Noach (Natan) Zelechower was imprisoned during World War II. His first wife and their daughter were transported from the Warsaw Ghetto to Treblinka and perished there during the Great Deportation of the Warsaw Jews in the summer of 1942, and he was left alone to face the threat of Nazi persecution and death.\nWith great resilience, fortitude, and the hope to be reunited with his wife and daughter, Noach was able to withstand and survive the hardships of the camp world, forced labor, and death marches. Throughout the war he kept repeating his daughter's words in her last note:\n""Daddy, save yourself! Perhaps fate will bring us back together again.""\n\nHe wrote his memoir in 1946, a few months after he returned to Warsaw and after confirming that his family had perished. In his memoir ""I SURVIVED TO TELL"", with detailed descriptions of knowing hunger and the methods of torture by which his captors tormented him and his friends, Noach wrote about the prisoners' relationships with one another and emphasizes the loss of hope. Alongside manifestations of sympathy and help, he powerfully illustrates the despair, the suffering, and the pain that dulled people's emotions.\nAfter the war, Noach married Paulina Weinreb, a Holocaust survivor as well, and in 1947 their only daughter Hana (Ani) was born.",112,0.99,Noach Zelechower,Biography/Memoir,https://shopper915963729.wpcomstaging.com/wp-content/uploads/2022/05/112.jpg
B09ST89GVW,simple,companion212,More Than A Companion,1,0,visible,,,,taxable,,1,,,0,0,,,,,0,,,,,,,,,,,,,TRUE,-9,"Sent to be her aunt's companion by an impoverished father, Miss Honora Gregory struggles against disappointment and loneliness. Now in London, Honora's aunt seeks only her own entertainment and Honora is forced into the background. Blunt and forthright, she does not hide her true opinion despite her lowly status. When her aunt gives her one evening, one opportunity of finding a gentleman to court her, Honora knows exactly which gentleman in particular she will make certain to avoid - the arrogant and selfish Lord Crampton.\n\nRobert, the Earl of Crampton is irritated with the lady. Even though she is only a companion, Robert finds himself caught up with her, angry at her manner towards him. When someone begins to bring trouble to Robert's door, he is astonished to find that Honora is the one by his side. Will she be willing to help him, if he should ask? And can he eschew his pride and see her as more than just a companion?'",212,2.99,Rose Pearson,Romance,https://shopper915963729.wpcomstaging.com/wp-content/uploads/2022/05/212.jpg
B07PDP5YMW,simple,games312,Deadly Games,1,0,visible,,,,taxable,,1,,,0,0,,,,,0,,,,,,,,,,,,,TRUE,-9,"A killer is playing deadly games with local students- and the only prize is murder.\nDetective Chief Inspector Whitney Walker has worked hard to get where she is. A single mother, she joined the police force when she was eighteen and never looked back- until one wrong move put her in jeopardy of losing her job. So when a serial killer starts murdering female students at a nearby university, she knows this is it: her chance to stop a killer and redeem her career- or blow it and say goodbye to the job she loves.\n\nAided (and sometimes impeded) by Dr Georgina Cavendish, a lecturer who steps out of the isolated world of academia when one of her students is murdered, Walker soon arrests the obvious culprit. Everything seems to have worked out-\n\n- until another girl is murdered while Cavendish and Walker's prime suspect is still behind bars.\n\nNow, Walker is being removed from the case, replaced by someone a bit more ""suitable."" But when Cavendish persuades her to continue working the case, the two women join forces to discover the truth and solve the mystery behind the killings- before Walker's own daughter becomes the next victim of a serial killer's Deadly Games.",312,2.99,Sally Rigby,Mystery/Thriller,https://shopper915963729.wpcomstaging.com/wp-content/uploads/2022/05/312.jpg
B06ZYBFVVN,simple,phoenix412,Fury Of A Phoenix,1,0,visible,,,,taxable,,1,,,0,0,,,,,0,,,,,,,,,,,,,TRUE,-9,"""I knew the sins of my past would call to collect what was left of my soul. If I'd known the price I'd pay, I would've sacrificed more to stay hidden from the magic.\n \nIn the middle of Wyoming-away from the abnormals of the world-I thought I was free and clear. I started a new life. Found a love I'd never known in a husband, and a son who was my everything.\n \nAnd in a blinding instant, that life was stolen from me.\n \nThe rage of a grieving mother is an ugly beast. More so when she has the skills and killer instinct to back up the wrath and the knowledge that an accident was anything but.\n \nOnce more, I will pick up my guns. This time to hunt those who took my husband's and son's lives.\n \nLet them see the assassin, trained to kill abnormals, stalk the shadows again.\n \nLet them see the Phoenix rise from the fragments of a broken life as she burns with a fury that cannot be contained.\n \nLet the killing games begin.",412,2.99,Shannon Mayer,Fantasy,https://shopper915963729.wpcomstaging.com/wp-content/uploads/2022/05/412.jpg
B087SY3B9K,simple,hades512,The Power Of Hades,1,0,visible,,,,taxable,,1,,,0,0,,,,,0,,,,,,,,,,,,,TRUE,-9,"I've been kidnapped by Zeus. Plucked from the streets of Manhattan and frightened half to death by a freaking Olympian god.\nAnd now I'm trapped in the Underworld, being forced to compete in a series of deadly trials for the position of Queen of the Underworld. Which would mean marrying Hades, the utterly terrifying Lord of the Dead. Who the hell wants a husband at all, let alone one made of smoke and riddled with death?\n\n\nI have to get back home, to New York and my brother. But I can't leave without completing the trials and they've been designed for a godly Queen, not Persephone - barista and botanical garden enthusiast.\nI'm surrounded by lethal, all-powerful maniacs. Sexy-as-hell maniacs, sure, but as dangerous as they come. And I'm going to have to prove to all of them that there's a goddess of hell inside me. It's the only way I'll survive the Hades Trials. But then what? And why, why, why am I so desperate to see under Hades smoky exterior and find out what he's hiding from me?\n\n\nIf I win the trials, I have to marry the devil himself. But losing might mean losing my life.",512,0.99,Eliza Raine,Science Fiction,https://shopper915963729.wpcomstaging.com/wp-content/uploads/2022/05/512.jpg
B09C66SKLH,simple,black113,Black Cop's Kid,1,0,visible,,,,taxable,,1,,,0,0,,,,,0,,,,,,,,,,,,,TRUE,-8,"Growing up in New York City in the 1950s and 1960s, Kareem Abdul-Jabbar listened to jazz, watched Jackie Robinson at Ebbets Field, and saw a Black pop-culture icon in a TV western. It kick-started Kareem's interest in a rich history erased by white educators. It also sparked his activism. During these years, as Kareem struggled with racism, visibility, and justice, his father's presence loomed large with purpose. He was a Black cop weathering a complicated conflict of loyalties during the most tumultuous civil rights upheaval the country had ever been through. Now, at a time when his powerful voice is needed the most, Kareem shares his unique perspective from the front lines of sixty years of social change, not just as an activist, but as a son, an athlete, a writer, and a Black man in America.",113,1.99,Kareem Abdul-Jabbar,Biography/Memoir,https://shopper915963729.wpcomstaging.com/wp-content/uploads/2022/05/113.jpg
B088LM4ZJ5,simple,protecting213,Protecting You,1,0,visible,,,,taxable,,1,,,0,0,,,,,0,,,,,,,,,,,,,TRUE,-8,"Grace Miles misses her easy friendship with Asher, but growing up means growing apart. And really, how could he fall for her when they spent their childhood getting muddy in the creek and splitting sticks of gum? But this summer, something feels different. If Grace didn't know better, she'd think Asher was flirting with her. Those dark eyes, hard body, and wicked smile make her insides swirl and her heart dare to hope for things she's convinced herself she'll never have.\n\nFalling for your best friend shouldn't be complicated, but for Asher Bailey, loving Grace is anything but simple. The road to romance isn't smooth thanks to his pack of wild brothers who are protective of the girl next door, a take-no-sass grandmother, a small town where gossip is a spectator sport, and a feud that spans generations. But Asher realizes his feelings are too big to ignore.\n\nLoving her isn't the risk. Losing her would be.\n\nAnd one night, one kiss, changes everything. Finally admitting their feelings is the beginning of their happily ever after. Until their fairy tale love story is tragically interrupted, and neither of them will ever be the same.",213,2.99,Claire Kingsley,Romance,https://shopper915963729.wpcomstaging.com/wp-content/uploads/2022/05/213.jpg
B08NF7XRZK,simple,conviction313,Escaping Conviction,1,0,visible,,,,taxable,,1,,,0,0,,,,,0,,,,,,,,,,,,,TRUE,-8,"He walked away once- he won't make that mistake again.\n\nFormer MF7 Operative Jason Stone is back in town and he can't stop thinking about the woman he left behind: Jules Bellerose. She's the love of his life, the one that got away- but he's the bullet she dodged.\n\nEver since he ghosted her, Jules has made a name for herself, arguing for second chances in every courthouse across the southeast. When Jason's sister goes missing, he's the prime suspect, and he needs the best defense attorney there is. Good thing he still remembers her number.\n\nJules swore off love after Jason broke her heart. Defending her clients is her main priority now. But when her past collides with her present, it gets harder to believe that Jason is ""just a client."" Especially after one heated argument in particular becomes much, much more.\n\nWhen her own life is in danger, the tables turn and she has to depend on Jason to be her protector again. Self-control is impossible when it's just the two of them, but what will he think of her after she confesses her own secrets?\n\nOnly one thing is for certain.\n\nKeeping her hands off her new client will be the toughest case she's had yet.",313,1.49,Greer Rivers,Mystery/Thriller,https://shopper915963729.wpcomstaging.com/wp-content/uploads/2022/05/313.jpg
B094TZC6SY,simple,dragon413,A Dragon's Chains,1,0,visible,,,,taxable,,1,,,0,0,,,,,0,,,,,,,,,,,,,TRUE,-8,"Dragons are slaves.\n\nUsing stolen magic, the human Kingdom of Rolm has risen to power on the backs of the world's most formidable predator, but that is about to change. Bayloo is the first of the free dragons. Born into slavery, his shackled mind has awoken to find a human giving him orders and his race enthralled to an evil king. The world shall now face the rage of dragons.\n\nExperience a fearsome struggle of magic and cunning between humans and dragons, where victory will determine the fate of the world.\n\nA fantasy epic.",413,2.99,Robert Vane,Fantasy,https://shopper915963729.wpcomstaging.com/wp-content/uploads/2022/05/413.jpg
B07WKBZQMZ,simple,nepenthe513,Nepenthe,1,0,visible,,,,taxable,,1,,,0,0,,,,,0,,,,,,,,,,,,,TRUE,-8,"""It will take the whole night at least,"" he said, ""to implant all my eggs.""\n\nThe colony planet is a death trap. Only the tiniest fraction of humanity survives the gruesome rejection virus.\n\nAnd then the aliens arrive.\n\nThe Nepenthe, too, seek a new home world, but discover instead a species capable of incubating their precious eggs: humans.\n\nThe two dying races can either reach an agreement to help each other live on - or prepare for extinction.",513,2.99,Octavia Hyde,Science Fiction,https://shopper915963729.wpcomstaging.com/wp-content/uploads/2022/05/513.jpg
B08YZ6689X,simple,leopard114,The Man Eating Leopard of Rudraprayag,1,0,visible,,,,taxable,,1,,,0,0,,,,,0,,,,,,,,,,,,,TRUE,-7,"An exciting narrative of a leopard that spread terror through five hundred square miles of the hills of the United Provinces, The Man-eating Leopard of Rudraprayag also takes a detailed look at life in the Garhwal region of India. The Man Eating Leopard of Rudraprayag is often considered the most exciting of all Corbett's jungle tales. He gives a carefully-detailed account of a notorious leopard that terrorized life in the hills of the colonial United Provinces. This story represents Corbett's most sustained and unique effort.",114,1.49,Jim Corbett,Biography/Memoir,https://shopper915963729.wpcomstaging.com/wp-content/uploads/2022/05/114.jpg
B09BNSDMK1,simple,mountain214,The Mountain Man's Mail-Order Surprise,1,0,visible,,,,taxable,,1,,,0,0,,,,,0,,,,,,,,,,,,,TRUE,-7,"As an orphan who was raised by the Chippewa Indian tribe, Garrett Harding has grown up caught between two worlds.\nBelonging to neither the Chippewa people nor the nearby settlement of Iron Creek, Garrett has lived apart from both communities, welcoming the solitude of a life spent alone.\nBut now, he has had enough of the loneliness-now, Garrett wants a wife.\nKaty Jones is desperate.\nAfter a deadly pandemic left her a widow, Katy now finds herself trapped in a disease-ridden town.\nShe is desperate to flee before she falls victim to the same sickness that recently took the life of her husband-but her rebellious marriage left her disowned from her family, and now Katy has no one to turn to for protection or help.\nNeeding a way out of town fast, Katy advertises as a mail-order bride, and it seems that fortune is on her side when Garrett sends her his reply.\nHer journey to meet him in his homeland is a troubled one, but once she arrives, Garrett is there with his kindness and support, and Katy is hopeful for their future together.\nBut Katy is carrying a life-changing secret that she must keep from Garrett until after their wedding.\nAs their connection deepens, her guilt for deceiving Garrett begins to overwhelm her need for secrecy.\nBut if he learns the truth, Katy knows that Garrett might reject her and cast her out-and there is too much at stake for her to risk that.\nBut how long will she be able to keep the truth from her husband-to-be?'",214,0.99,Karla Gracey,Romance,https://shopper915963729.wpcomstaging.com/wp-content/uploads/2022/05/214.jpg
B07PDMLHHP,simple,autumn314,Black Autumn,1,0,visible,,,,taxable,,1,,,0,0,,,,,0,,,,,,,,,,,,,TRUE,-7,"A Special Forces commando returns home from combat to America on the edge of apocalypse. He and his family land a gig running security for a wealthy clan of survivors, yet most of the group struggles to make peace with the sudden death of modern sensibilities and woke culture.\n\nCan a few salty warfighters convince plastic surgeons, realtors and human resource managers that they must pick up their guns and fight or their families will die?\n\nGreen Beret, Jeff Kirkham, and his buddies think they're locked and loaded for yet another war, but nothing can prepare them for the runaway violence of America after a cascade of terrorism, government blunder and Facebook nastiness strips away the urban dreamscape.\n\nAt what point do everyday people turn the corner and become warriors?""",314,0.99,Jeff Kirkham,Mystery/Thriller,https://shopper915963729.wpcomstaging.com/wp-content/uploads/2022/05/314.jpg
